statement,statement_clean,speaker,subject,party_affiliation,context,label,y,baseline_pred,final_linear_pred,xgb_pred
Wisconsin is on pace to double the number of layoffs this year.,wisconsin is on pace to double the number of layoffs this year,OTHER,jobs,democrat,a news conference,false,0,1,1,1
"Says 57 percent of federal spending goes to the military and just 1 percent goes to food and agriculture, including food stamps.",says 57 percent of federal spending goes to the military and just 1 percent goes to food and agriculture including food stamps,facebook-posts,OTHER,none,a meme on social media,false,0,1,0,1
Ronald Reagan faced an even worse recession than the current one.,ronald reagan faced an even worse recession than the current one,sarah-palin,"economy,history",republican,OTHER,false,0,1,0,1
Says Charlie Crist is embroiled in a fraud case for steering taxpayer money to a de facto Ponzi scheme.,says charlie crist is embroiled in a fraud case for steering taxpayer money to a de facto ponzi scheme,republican-party-florida,"jobs,state-budget",republican,a TV ad,false,0,0,0,1
Its been since 1888 that a Senate of a different party than the president in the White House confirmed a Supreme Court nominee.,its been since 1888 that a senate of a different party than the president in the white house confirmed a supreme court nominee,cory-gardner,OTHER,republican,OTHER,false,0,1,1,1
"Under Rosemary Lehmberg, the Travis County D.A.s office convened the grand jury that indicted Rick Perry.",under rosemary lehmberg the travis county d a s office convened the grand jury that indicted rick perry,sarah-palin,"crime,criminal-justice",republican,a commentary,false,0,1,1,1
"In 1993, Newt Gingrich first advocated for the individual mandate in health care. And as recently as May of this year, he was still advocating for it.",in 1993 newt gingrich first advocated for the individual mandate in health care and as recently as may of this year he was still advocating for it,michele-bachmann,health-care,republican,OTHER,mostly-true,1,1,1,0
"A proposed tax to fund transportation projects would spend $90,000 to take a single vehicle off the road during the morning and afternoon commute.",a proposed tax to fund transportation projects would spend 90 000 to take a single vehicle off the road during the morning and afternoon commute,OTHER,transportation,republican,OTHER,false,0,1,1,1
Hillary Clinton said gun confiscation would be worth considering.,hillary clinton said gun confiscation would be worth considering,national-rifle-association,guns,none,OTHER,barely-true,1,1,1,0
I did not play any role in bringing the company to RI as did others in government. I was tasked with handling the legislation affecting the company by my superiors.,i did not play any role in bringing the company to ri as did others in government i was tasked with handling the legislation affecting the company by my superiors,OTHER,OTHER,democrat,a statement,false,0,1,1,1
The tax cut deal is giving $700 billion to millionaires and billionaires.,the tax cut deal is giving 700 billion to millionaires and billionaires,sherrod-brown,OTHER,democrat,a CNN interview,false,0,1,1,1
A strong bipartisan majority in the House of Representatives voted to defund Obamacare.,a strong bipartisan majority in the house of representatives voted to defund obamacare,ted-cruz,OTHER,republican,a news release,false,0,1,1,1
What the facts say is ...the best scenario for kids is a loving mom and dad.,what the facts say is the best scenario for kids is a loving mom and dad,reince-priebus,OTHER,republican,"comments on ""Meet the Press""",false,0,1,0,1
Says Mark Neumann = Nancy Pelosi,says mark neumann nancy pelosi,scott-walker,OTHER,republican,OTHER,false,0,1,1,1
Says delegates cant legally change the Republican National Convention rules to prevent Donald Trumps nomination.,says delegates cant legally change the republican national convention rules to prevent donald trumps nomination,donald-trump,OTHER,republican,"an interview on ""Meet the Press""",barely-true,1,1,0,0
On banning earmarks.,on banning earmarks,bill-nelson,federal-budget,democrat,OTHER,false,0,1,1,1
A judges order means theres a Constitution exemption zone if you live within 100 miles of the United States border.,a judges order means theres a constitution exemption zone if you live within 100 miles of the united states border,facebook-posts,OTHER,none,a Facebook post,false,0,1,0,1
"Under Mayor Tom Barrett, the number of Milwaukee police officers has not increased.",under mayor tom barrett the number of milwaukee police officers has not increased,OTHER,OTHER,none,an interview,true,1,1,1,0
"President Obama, Sen. Harry Reid and Rep. Nancy Pelosi passed a $1.2 trillion stimulus bill.",president obama sen harry reid and rep nancy pelosi passed a 1 2 trillion stimulus bill,george-allen,stimulus,republican,UNKNOWN,pants-fire,0,1,1,1
"Says Donald Trump said of women, And you can tell them to go f--- themselves.",says donald trump said of women and you can tell them to go f themselves,priorities-usa-action,women,democrat,a television ad,pants-fire,0,1,1,1
"The Taliban has been there for years and years, I mean, hundreds of thousands of years.",the taliban has been there for years and years i mean hundreds of thousands of years,kendrick-meek,OTHER,democrat,a debate,pants-fire,0,1,1,1
Iran President Hassan Rouhani has more Cabinet members with Ph.D.s from American universities than members of Barack Obamas Cabinet.,iran president hassan rouhani has more cabinet members with ph d s from american universities than members of barack obamas cabinet,OTHER,OTHER,journalist,OTHER,true,1,1,0,0
"(Barack Obama) says hes going to reduce the long-term debt and deficit by $4 trillion, doesnt say how hes going to do it.",barack obama says hes going to reduce the long term debt and deficit by 4 trillion doesnt say how hes going to do it,chris-christie,OTHER,republican,OTHER,pants-fire,0,1,1,1
Birth control pioneer Margaret Sanger wasan active participant in the Ku Klux Klan.,birth control pioneer margaret sanger wasan active participant in the ku klux klan,OTHER,abortion,republican,a Facebook post,false,0,0,1,1
U.S. Rep. Lloyd Doggett is the most liberal man in the United States Congress.,u s rep lloyd doggett is the most liberal man in the united states congress,OTHER,"bipartisanship,candidates-biography",republican,a speech,false,0,1,1,1
On an income cap for recipients of the popular HOPE scholarship,on an income cap for recipients of the popular hope scholarship,jason-carter,education,democrat,OTHER,false,0,1,1,1
On running a civil and polite campaign.,on running a civil and polite campaign,roy-barnes,"message-machine,campaign-advertising",democrat,a television interview,half-true,1,0,0,0
"John Holdren, director of the White House Office of Science and Technology Policy, has proposed forcing abortions and putting sterilants in the drinking water to control population.",john holdren director of the white house office of science and technology policy has proposed forcing abortions and putting sterilants in the drinking water to control population,glenn-beck,OTHER,none,OTHER,pants-fire,0,1,1,1
I did not I did not I do not say that. I do not say that climate change is a hoax perpetrated by the Chinese.,i did not i did not i do not say that i do not say that climate change is a hoax perpetrated by the chinese,donald-trump,OTHER,republican,a presidential debate,barely-true,1,1,1,0
I can tell you that the enhanced interrogation techniques that have since been banned by this administration specifically waterboarding work.,i can tell you that the enhanced interrogation techniques that have since been banned by this administration specifically waterboarding work,OTHER,OTHER,republican,a newspaper interview,false,0,1,1,1
Virginia has made no progress on jobs since Bob McDonnell took office.,virginia has made no progress on jobs since bob mcdonnell took office,democratic-party-virginia,"jobs,message-machine-2012",democrat,a web video,false,0,1,1,1
The Iraq Study Group reported that (Saddam Hussein) had designs on reviving his nuclear program.,the iraq study group reported that saddam hussein had designs on reviving his nuclear program,fred-thompson,iraq,republican,OTHER,false,0,0,1,1
On pay for fired Milwaukee police officers,on pay for fired milwaukee police officers,alberta-darling,state-budget,republican,an interview,false,0,1,1,1
Says CNN reported Ben Carson was taking a break from campaigning and the Cruz campaign forwarded that news to our volunteers.,says cnn reported ben carson was taking a break from campaigning and the cruz campaign forwarded that news to our volunteers,ted-cruz,candidates-biography,republican,OTHER,false,0,1,1,1
There is no record of congresswoman Betty Sutton ... ever holding a single in-person town hall meeting open to the general public.,there is no record of congresswoman betty sutton ever holding a single in person town hall meeting open to the general public,jim-renacci,job-accomplishments,republican,a news release,false,0,1,1,1
Iraq has the second-largest oilfields in the world (behind) Saudi Arabia.,iraq has the second largest oilfields in the world behind saudi arabia,donald-trump,OTHER,republican,OTHER,mostly-true,1,1,0,0
Says he got twice as much money from the sale of County Grounds land than Milwaukee County Executive Scott Walker was willing to accept.,says he got twice as much money from the sale of county grounds land than milwaukee county executive scott walker was willing to accept,lee-holloway,job-accomplishments,none,OTHER,barely-true,1,1,0,0
On the Bush tax cuts.,on the bush tax cuts,john-mccain,taxes,republican,flip-o-meter,false,0,1,1,1
Says American polling shows Russian President Vladimir Putin has an 80 percent approval rating.,says american polling shows russian president vladimir putin has an 80 percent approval rating,donald-trump,polls,republican,"an interview on NBC's ""Meet the Press""",true,1,1,1,0
I can tell you with certainty (capandtrade)would have a devastating impact on our economy.,i can tell you with certainty capandtrade would have a devastating impact on our economy,marco-rubio,"cap-and-trade,climate-change",republican,OTHER,false,0,1,0,1
Says Denmarks suicide rate has been about twice as high as the United States over the past five decades.,says denmarks suicide rate has been about twice as high as the united states over the past five decades,viral-image,OTHER,none,OTHER,barely-true,1,1,0,0
"China has total control, just about, of North Korea.",china has total control just about of north korea,donald-trump,"foreign-policy,nuclear",republican,OTHER,barely-true,1,1,0,0
The fact is the Clinton Foundation has got about 80 percent in overhead and 20 percent of the money is actually getting into the places it should.,the fact is the clinton foundation has got about 80 percent in overhead and 20 percent of the money is actually getting into the places it should,reince-priebus,candidates-biography,republican,OTHER,false,0,1,1,1
The U.S. Constitution owes its notion of democracy to the Iroquois Tribes.,the u s constitution owes its notion of democracy to the iroquois tribes,facebook-posts,OTHER,none,OTHER,barely-true,1,1,0,0
"Gov. Romney himself, with 28 other Republican governors, supported policies that would have eliminated the time limits in the welfare reform law and allowed people to stay on welfare forever.",gov romney himself with 28 other republican governors supported policies that would have eliminated the time limits in the welfare reform law and allowed people to stay on welfare forever,jay-carney,welfare,none,OTHER,false,0,1,1,1
"Under Lt. Gov. Lee Fisher, Ohio is 44th in the country in terms of getting money actually into worker retraining.",under lt gov lee fisher ohio is 44th in the country in terms of getting money actually into worker retraining,rob-portman,"economy,government-efficiency,jobs",republican,a debate,false,0,1,1,1
"Right now, an employer has more of a chance of getting hit by lightning than be prosecuted for hiring an undocumented worker. That has to change.",right now an employer has more of a chance of getting hit by lightning than be prosecuted for hiring an undocumented worker that has to change,barack-obama,immigration,democrat,Las Vegas,false,0,1,1,1
Wisconsin dropped from second in the country to 41st among states where more than half the students took the ACT exam.,wisconsin dropped from second in the country to 41st among states where more than half the students took the act exam,state-democratic-party-wisconsin,OTHER,democrat,a news release,pants-fire,0,1,1,1
Says an Obama administration policy prohibits people who work with at-risk youth from promoting marriage as a way to avoid poverty.,says an obama administration policy prohibits people who work with at risk youth from promoting marriage as a way to avoid poverty,rick-santorum,OTHER,republican,OTHER,false,0,1,1,1
Loranne Ausley voted six times to tax your savings.,loranne ausley voted six times to tax your savings,republican-party-florida,taxes,republican,OTHER,false,0,1,1,1
"The percentage of black children born without a father in the home has risen from 7 percent in 1964 to 73 percent today, due to changes from President Lyndon Johnsons Great Society.",the percentage of black children born without a father in the home has risen from 7 percent in 1964 to 73 percent today due to changes from president lyndon johnsons great society,facebook-posts,OTHER,none,OTHER,false,0,1,1,1
ACORN could get up to $8.5 billion more tax dollars despite being under investigation for voter registration fraud in a dozen states.,acorn could get up to 8 5 billion more tax dollars despite being under investigation for voter registration fraud in a dozen states,michele-bachmann,federal-budget,republican,a press release,false,0,1,0,1
"Says Congressman Jon Runyan does not want to cut taxes for the middle class, but only for millionaires.",says congressman jon runyan does not want to cut taxes for the middle class but only for millionaires,democratic-congressional-campaign-committee,taxes,democrat,a video posted on YouTube,barely-true,1,1,0,0
Under Hillary Clintons plan illegal immigrants convicted of committing crimes get to stay.,under hillary clintons plan illegal immigrants convicted of committing crimes get to stay,donald-trump,immigration,republican,a TV ad,half-true,1,1,1,0
"The Obama administration leaked information, deliberately or otherwise, that led to the identification of the Pakistani doctor that helped us in achieving our goals and killing bin Laden.",the obama administration leaked information deliberately or otherwise that led to the identification of the pakistani doctor that helped us in achieving our goals and killing bin laden,OTHER,OTHER,none,a web video,false,0,1,1,1
Says President Barack Obama spent nearly a trillion dollars on make-work government jobs.,says president barack obama spent nearly a trillion dollars on make work government jobs,rand-paul,OTHER,republican,OTHER,false,0,1,1,1
Says a Ted Cruz ad has got me bull-dozing down a house.I never bulldozed it down. Its false advertising.,says a ted cruz ad has got me bull dozing down a house i never bulldozed it down its false advertising,donald-trump,housing,republican,"an interview on NBC's ""Meet the Press""",half-true,1,1,0,0
"In the 513 days between Trayvon dying, and todays verdict, 11,106 African-Americans have been murdered by other African-Americans.",in the 513 days between trayvon dying and todays verdict 11 106 african americans have been murdered by other african americans,tweets,crime,none,tweets,barely-true,1,1,0,0
Says Republican Rep. Charlie Dent wants to kick the Freedom Caucus out of the Republican conference for voting our conscience.,says republican rep charlie dent wants to kick the freedom caucus out of the republican conference for voting our conscience,dave-brat,OTHER,republican,"comments on ""Meet the Press""",false,0,1,0,1
"He was offered medical care for his injuries if he would give up military information in return. John McCain said, 'No.' ",he was offered medical care for his injuries if he would give up military information in return john mccain said 'no ',fred-thompson,candidates-biography,republican,a speech at the Republican National Convention,false,0,1,1,1
Two-thirds of Wisconsin corporations dont pay state income taxes.,two thirds of wisconsin corporations dont pay state income taxes,one-wisconsin-now,OTHER,organization,OTHER,mostly-true,1,1,1,0
Obamacare ... will kill jobs across America.,obamacare will kill jobs across america,us-chamber-commerce,OTHER,none,a television ad,false,0,1,1,1
"Says his bill, HB 97, would prevent the use of taxpayer dollars on abortions.",says his bill hb 97 would prevent the use of taxpayer dollars on abortions,OTHER,"abortion,health-care",republican,OTHER,false,0,1,1,1
Federal health care reforms amounted to the government takeover of health care.,federal health care reforms amounted to the government takeover of health care,tommy-thompson,health-care,republican,a television ad,pants-fire,0,0,0,1
"When he worked for ATT, he ""was responsible for large parts in a $5 billion organization.""",when he worked for att he was responsible for large parts in a 5 billion organization,OTHER,job-accomplishments,republican,UNKNOWN,false,0,1,1,1
"Of the roughly 15 percent of Americans who dont have health insurance, half of them made more than $50,000 a year.",of the roughly 15 percent of americans who dont have health insurance half of them made more than 50 000 a year,rand-paul,OTHER,republican,OTHER,false,0,1,1,1
"McCain ""has opposed stem cell research.""",mccain has opposed stem cell research,barack-obama,health-care,democrat,a radio ad,false,0,1,1,1
"The EPA wants to hire 230,000 new government regulators that will cost the taxpayer $21 billion.",the epa wants to hire 230 000 new government regulators that will cost the taxpayer 21 billion,allen-west,OTHER,republican,a TV interview,false,0,1,0,1
Victory! Republicans by 2 to 1 vote to endorse Mark Neumann on first ballot at GOP convention.,victory republicans by 2 to 1 vote to endorse mark neumann on first ballot at gop convention,mark-neumann,elections,republican,a website alert,false,0,1,0,1
Foreign Chinese prostitution money is allegedly behind the groups funding Congressman Sean Duffys Republican Majority.,foreign chinese prostitution money is allegedly behind the groups funding congressman sean duffys republican majority,democratic-congressional-campaign-committee,campaign-finance,democrat,a news release,pants-fire,0,1,1,1
Rhode Islands unemployment insurance system is the most expensive such system in the country.,rhode islands unemployment insurance system is the most expensive such system in the country,kenneth-block,OTHER,republican,OTHER,false,0,1,1,1
"Says a YouTube video shows Thomas DiMassimo, the man who rushed Trump at an Ohio rally, dragging the American flag on the ground like it was a piece of garbage.",says a youtube video shows thomas dimassimo the man who rushed trump at an ohio rally dragging the american flag on the ground like it was a piece of garbage,donald-trump,elections,republican,OTHER,true,1,1,0,0
The United States is at historic record highs of individuals being apprehended on the border from countries with terrorist ties such as Pakistan or Afghanistan or Syria.,the united states is at historic record highs of individuals being apprehended on the border from countries with terrorist ties such as pakistan or afghanistan or syria,rick-perry,OTHER,republican,"comments on CNN's ""State of the Union""",pants-fire,0,1,1,1
"Says the estate tax, in many cases, forces family farmers and small businesses owners to sell their holdings.",says the estate tax in many cases forces family farmers and small businesses owners to sell their holdings,robert-hurt,OTHER,republican,a statement.,false,0,1,1,1
Sayvideo shows massive alligator strolling across Florida golf course.,sayvideo shows massive alligator strolling across florida golf course,blog-posting,animals,none,OTHER,true,1,1,0,0
The Red Sox waited 87 long years to win the World Series.,the red sox waited 87 long years to win the world series,mitt-romney,OTHER,republican,OTHER,false,0,1,1,1
"The largest tax increase that we have ever had in our state is yours it is the business margins tax that you signed, governor.",the largest tax increase that we have ever had in our state is yours it is the business margins tax that you signed governor,kay-bailey-hutchison,OTHER,republican,OTHER,false,0,1,0,1
We are giving almost $2 billion of taxpayer money to the junk food and fast food industries every year to make the (childhood obesity) epidemic worse.,we are giving almost 2 billion of taxpayer money to the junk food and fast food industries every year to make the childhood obesity epidemic worse,dennis-kucinich,OTHER,democrat,a news release,false,0,1,1,1
There is a precedent for not nominating someone to the U.S. Supreme Court in the middle of a presidential election.,there is a precedent for not nominating someone to the u s supreme court in the middle of a presidential election,paul-ryan,OTHER,republican,an interview,false,0,1,1,1
"There is no disagreement that we need action by our government, a recovery plan that will help to jump-start the economy.",there is no disagreement that we need action by our government a recovery plan that will help to jump start the economy,barack-obama,"economy,stimulus",democrat,a news conference,false,0,1,1,1
"McCain ""still thinks it's okay when women don't earn equal pay for equal work.""",mccain still thinks it's okay when women don't earn equal pay for equal work,hillary-clinton,legal-issues,democrat,OTHER,false,0,1,1,1
"Says Rick Perrys Pay to Play politics led him to send $899 million to an offshore call center in Bermuda, driving down enrollment in childrens health insurance",says rick perrys pay to play politics led him to send 899 million to an offshore call center in bermuda driving down enrollment in childrens health insurance,texas-democratic-party,health-care,democrat,news release,false,0,1,1,1
"Medicare costs have slowed down dramatically. In fact, the first two months of this fiscal year, Medicare costs were down even in nominal terms relative to the previous year.",medicare costs have slowed down dramatically in fact the first two months of this fiscal year medicare costs were down even in nominal terms relative to the previous year,OTHER,"federal-budget,health-care,medicare",democrat,"an interview on CNN's ""State of the Union""",true,1,1,1,0
Theres been no conclusive or specific report to say Russia was trying to muddy the election.,theres been no conclusive or specific report to say russia was trying to muddy the election,reince-priebus,OTHER,republican,"comments on ""Meet the Press""",false,0,1,0,1
"In California, the windmills are killing hundreds and hundreds of eagles.",in california the windmills are killing hundreds and hundreds of eagles,donald-trump,"energy,environment",republican,OTHER,barely-true,1,1,0,0
Says Gov. Scott Walker dropped out or was kicked out of college short of a degree not long after he was kicked out of student elections at Marquette University.,says gov scott walker dropped out or was kicked out of college short of a degree not long after he was kicked out of student elections at marquette university,state-democratic-party-wisconsin,"candidates-biography,education",democrat,a web posting,false,0,1,0,1
Wisconsins projected state budget shortfall is now as low as $1.5 billion,wisconsins projected state budget shortfall is now as low as 1 5 billion,OTHER,state-budget,democrat,OTHER,false,0,1,1,1
Heroin .. pours across our southern borders.,heroin pours across our southern borders,donald-trump,drugs,republican,the third presidential debate,true,1,1,0,0
Says Mitt Romney supports cap and trade.,says mitt romney supports cap and trade,rick-santorum,OTHER,republican,OTHER,false,0,1,1,1
"The State Election Board has issued nearly $275,000 in fines to violators of absentee ballot laws.",the state election board has issued nearly 275 000 in fines to violators of absentee ballot laws,brian-kemp,elections,republican,UNKNOWN,true,1,1,1,0
My supporters arent special interest groups in Madison and Milwaukee.,my supporters arent special interest groups in madison and milwaukee,mark-neumann,campaign-finance,republican,OTHER,mostly-true,1,1,1,0
The government is trying to now close the Lincoln Memorial for any kind of large gatherings.,the government is trying to now close the lincoln memorial for any kind of large gatherings,glenn-beck,OTHER,none,OTHER,pants-fire,0,1,0,1
You know what (Saddam Hussein) did well? He killed terrorists.,you know what saddam hussein did well he killed terrorists,donald-trump,"foreign-policy,terrorism",republican,OTHER,barely-true,1,1,0,0
The immigration bill has a specific provision that says that Secretary Napolitano does not have to build any fence if she chooses not to.,the immigration bill has a specific provision that says that secretary napolitano does not have to build any fence if she chooses not to,jeff-sessions,immigration,republican,OTHER,false,0,1,1,1
"Says the stimulus bill sent tax credits overseas, such as half a billion to an electric car company that created hundreds of jobs in Finland.",says the stimulus bill sent tax credits overseas such as half a billion to an electric car company that created hundreds of jobs in finland,americans-prosperity,OTHER,none,a TV ad,false,0,1,0,1
Six thousand people have sought addiction treatment through expanded Medicaid.,six thousand people have sought addiction treatment through expanded medicaid,maggie-hassan,OTHER,democrat,OTHER,false,0,1,1,1
