statement,statement_clean,speaker,subject,party_affiliation,context,label,y,baseline_pred,final_linear_pred,xgb_pred
Says the oil industry subsidies that President Barack Obama is attacking dont exist,says the oil industry subsidies that president barack obama is attacking dont exist,OTHER,"energy,taxes",republican,a news conference,false,0,1,0,1
"Says Bill Pascrell voted to eliminate all estate taxes for billionaires, and I voted no.",says bill pascrell voted to eliminate all estate taxes for billionaires and i voted no,steve-rothman,"message-machine-2012,taxes",democrat,a video posted on YouTube,barely-true,1,1,0,0
"In Hillary Clintons tax returns, you saw a lot of income coming from donors to the Clinton Foundation and people who benefitted from her State Department term as well.",in hillary clintons tax returns you saw a lot of income coming from donors to the clinton foundation and people who benefitted from her state department term as well,paul-manafort,OTHER,republican,"an interview on ""State of the Union""",half-true,1,1,0,0
State employees are actually going to get a pay raise.,state employees are actually going to get a pay raise,john-kasich,state-budget,republican,a news conference,false,0,1,1,1
Congressman Kasich wants to use our tax dollars to give secret bonuses to his corporate friends.,congressman kasich wants to use our tax dollars to give secret bonuses to his corporate friends,ted-strickland,OTHER,democrat,a campaign video,pants-fire,0,1,1,1
Says Rick Perry increased spending in Texas by more than 50 percent.,says rick perry increased spending in texas by more than 50 percent,michele-bachmann,"state-budget,state-finances",republican,OTHER,half-true,1,1,1,0
Property tax exemptions can be granted to small businesses that move into Milwaukee County.,property tax exemptions can be granted to small businesses that move into milwaukee county,chris-abele,OTHER,none,a campaign news release,false,0,1,1,1
Gov. Sarah Palin got precisely zero support for her call for Alaskas Democratic Senator Mark Begich to resign because Ted Stevens corruption conviction was overturned.,gov sarah palin got precisely zero support for her call for alaskas democratic senator mark begich to resign because ted stevens corruption conviction was overturned,rachel-maddow,"elections,pundits",none,OTHER,false,0,1,1,1
Says opponent David Dewhurst is a career politician.,says opponent david dewhurst is a career politician,OTHER,candidates-biography,republican,OTHER,false,0,1,1,1
Says Virginia economic development officials decided they didnt want to bid on his companys electric automobile plant.,says virginia economic development officials decided they didnt want to bid on his companys electric automobile plant,terry-mcauliffe,OTHER,democrat,a news conference.,false,0,1,1,1
The cost-of-living increase in Social Security is tied to wage inflation.,the cost of living increase in social security is tied to wage inflation,rick-santorum,social-security,republican,"an interview on NBC's ""Meet the Press""",false,0,1,0,1
The Department of Health and Human Services is providing $160 million to the state of Pennsylvania to set up a new high-risk insurance pool program that would cover any abortion legal in the state.,the department of health and human services is providing 160 million to the state of pennsylvania to set up a new high risk insurance pool program that would cover any abortion legal in the state,john-boehner,"abortion,health-care",republican,a news release,false,0,1,1,1
"Stimulus tax cuts ""began showing up in paychecks of 4.8 million Indiana households about three months ago.""",stimulus tax cuts began showing up in paychecks of 4 8 million indiana households about three months ago,barack-obama,"stimulus,taxes",democrat,OTHER,false,0,1,1,1
Says Hillary Clinton called the Trans-Pacific Partnership the gold standard. You called it the gold standard of trade deals. You said its the finest deal youve ever seen.,says hillary clinton called the trans pacific partnership the gold standard you called it the gold standard of trade deals you said its the finest deal youve ever seen,donald-trump,OTHER,republican,a Presidential debate,mostly-true,1,1,0,0
Barack Obama has doubled our national debt. Doubled it. Its going to be close to $20 trillion when he leaves.,barack obama has doubled our national debt doubled it its going to be close to 20 trillion when he leaves,donald-trump,OTHER,republican,OTHER,half-true,1,1,0,0
"Say Matt Wand cut Troutdale police, created a slush fund for himself.",say matt wand cut troutdale police created a slush fund for himself,OTHER,OTHER,democrat,a campaign mailer,pants-fire,0,0,1,1
Were second only to Boston in college students per capita.,were second only to boston in college students per capita,chris-abele,education,none,a speech,false,0,1,1,1
"Under Obamacare, The IRS will have access to the American peoples protected health care information.",under obamacare the irs will have access to the american peoples protected health care information,eric-cantor,"health-care,taxes",republican,a floor speech.,pants-fire,0,1,1,1
Homicides last year increased by 17 percent in Americas 50 largest cities. Thats the largest increase in 25 years.,homicides last year increased by 17 percent in americas 50 largest cities thats the largest increase in 25 years,donald-trump,"crime,criminal-justice",republican,OTHER,half-true,1,1,1,0
White men account for 69 percent of those arrested for violent crimes.,white men account for 69 percent of those arrested for violent crimes,OTHER,crime,columnist,OTHER,false,0,1,1,1
"The Great Wall of China, built 2,000 years ago, is 13,000 miles (long).",the great wall of china built 2 000 years ago is 13 000 miles long,donald-trump,history,republican,OTHER,half-true,1,1,0,0
''The leading Democratic candidate once said that the unfettered free market is the most destructive force in modern America.'',''the leading democratic candidate once said that the unfettered free market is the most destructive force in modern america '',rudy-giuliani,economy,republican,OTHER,false,0,1,1,1
"We have trade agreements with 20 countries, and we have trade surpluses with each one of those 20.",we have trade agreements with 20 countries and we have trade surpluses with each one of those 20,don-beyer,trade,democrat,an interview.,false,0,1,1,1
Congress' approval rating is 11 percent. You know who's higher? Dick Cheney and HMOs.,congress' approval rating is 11 percent you know who's higher dick cheney and hmos,bill-richardson,job-accomplishments,democrat,Las Vegas,false,0,1,1,1
Oil companies ...currently have 68-million acres that they're not using.,oil companies currently have 68 million acres that they're not using,barack-obama,energy,democrat,"a debate in Nashville, Tenn.",false,0,1,1,1
Germany is crime-riddled right now because of migration to Europe.,germany is crime riddled right now because of migration to europe,donald-trump,OTHER,republican,OTHER,barely-true,1,1,0,0
"During Obamas first five years as president, black unemployment increased 42 percent. During Reagans presidency, black unemployment dropped 20 percent.",during obamas first five years as president black unemployment increased 42 percent during reagans presidency black unemployment dropped 20 percent,facebook-posts,OTHER,none,a meme on social media,pants-fire,0,1,0,1
"Says President Obama said of the national debt, If I dont have this done in three years, then theres going to be a one-term proposition.",says president obama said of the national debt if i dont have this done in three years then theres going to be a one term proposition,americans-prosperity,OTHER,none,OTHER,false,0,1,0,1
"Says Texas has more than 80,000 abortions each year.",says texas has more than 80 000 abortions each year,OTHER,abortion,republican,a tweet,barely-true,1,1,1,0
Says Thomas Jefferson said that government is best which governs least.,says thomas jefferson said that government is best which governs least,scott-walker,OTHER,republican,a tweet,false,0,1,1,1
Forty-five percent of doctors say theyll quit if health care reform passes.,forty five percent of doctors say theyll quit if health care reform passes,glenn-beck,"health-care,pundits",none,OTHER,false,0,1,0,1
I have never said that I don't wear flag pins or refuse to wear flag pins.,i have never said that i don't wear flag pins or refuse to wear flag pins,barack-obama,patriotism,democrat,Philadelphia,false,0,1,1,1
The governor has made a commitment to billions of dollars in debt and new spending without any explanation of how he plans to pay that money back.,the governor has made a commitment to billions of dollars in debt and new spending without any explanation of how he plans to pay that money back,OTHER,transportation,democrat,a news release.,pants-fire,0,1,1,1
Says children are coming into the U.S. in staggering numbers because President Barack Obama has been promising amnesty.,says children are coming into the u s in staggering numbers because president barack obama has been promising amnesty,ted-cruz,immigration,republican,OTHER,false,0,1,0,1
There is no clinical evidence that vaccinating healthcare workers protects patients.,there is no clinical evidence that vaccinating healthcare workers protects patients,service-employees-international-union-committee-po,OTHER,newsmaker,OTHER,false,0,1,1,1
I made a bunch of these promises during the campaign. ... Weve got about 60 percent done in three years.,i made a bunch of these promises during the campaign weve got about 60 percent done in three years,barack-obama,OTHER,democrat,OTHER,false,0,1,1,1
Theres 400 more people working in health care today in New Hampshire than when we passed the budget.,theres 400 more people working in health care today in new hampshire than when we passed the budget,OTHER,OTHER,republican,OTHER,false,0,1,1,1
"Says, Yet in Salem they have traditionally waited until the money is almost gone to pay for the most important things in our states budget.",says yet in salem they have traditionally waited until the money is almost gone to pay for the most important things in our states budget,OTHER,"education,state-budget",republican,a campaign press release,false,0,1,1,1
Four members of the Rhode Island General Assembly went to vote in 2010 and were told they had already voted.,four members of the rhode island general assembly went to vote in 2010 and were told they had already voted,OTHER,OTHER,republican,a TV debate,false,0,1,1,1
"The Democrat-backed health care reform plan ""will require (Americans) to subsidize abortion with their hard-earned tax dollars.""",the democrat backed health care reform plan will require americans to subsidize abortion with their hard earned tax dollars,john-boehner,OTHER,republican,OTHER,false,0,1,0,1
Mark Warner cast the tiebreaking vote to pass Obamacare.,mark warner cast the tiebreaking vote to pass obamacare,ken-cuccinelli,"health-care,voting-record",republican,an interview.,barely-true,1,1,1,0
This is the first time in the history that weve had the raising of a debt limit also with spending cuts.,this is the first time in the history that weve had the raising of a debt limit also with spending cuts,allen-west,"federal-budget,history",republican,an interview on CNN,false,0,1,0,1
Republican-leaning states get more in federal dollars than they pay in taxes.,republican leaning states get more in federal dollars than they pay in taxes,blog-posting,OTHER,none,OTHER,mostly-true,1,1,1,0
Says President Barack Obama is a socialist.,says president barack obama is a socialist,rick-perry,OTHER,republican,OTHER,pants-fire,0,0,0,1
Wisconsin was literally broke when Republicans took office in January 2011.,wisconsin was literally broke when republicans took office in january 2011,OTHER,state-budget,republican,a tweet,false,0,1,1,1
Says Thom Tillis gives tax breaks to yacht and jet owners.,says thom tillis gives tax breaks to yacht and jet owners,senate-majority-pac,OTHER,democrat,a campaign ad,false,0,1,1,1
"During his time as House speaker, unemployment came down from 5.6 percent to under 4 (percent).",during his time as house speaker unemployment came down from 5 6 percent to under 4 percent,newt-gingrich,"job-accomplishments,jobs",republican,a campaign video,false,0,1,1,1
We had an amendment in the health care law that said the federal government is going to take over education.,we had an amendment in the health care law that said the federal government is going to take over education,allen-west,"education,health-care",republican,OTHER,false,0,1,0,1
"Four years as a congressman, he [U.S. Rep. Hank Johnson] never talked about MARTA.",four years as a congressman he u s rep hank johnson never talked about marta,OTHER,transportation,democrat,a candidate forum,pants-fire,0,1,1,1
"Like me, Scott Walker opposed the 1998 transportation bill and the $9 billion of wasteful spending.",like me scott walker opposed the 1998 transportation bill and the 9 billion of wasteful spending,jim-sensenbrenner,OTHER,republican,OTHER,false,0,1,1,1
"Steve Southerland did not pay his taxes in 05, 06, 07, 08 or 09.",steve southerland did not pay his taxes in 05 06 07 08 or 09,OTHER,"message-machine,taxes",democrat,a TV ad,false,0,1,1,1
Eliminating Obamacare ... saves $95 billion a year.,eliminating obamacare saves 95 billion a year,mitt-romney,OTHER,republican,OTHER,false,0,1,1,1
At least a quarter of those apprehended at the border have criminal records.,at least a quarter of those apprehended at the border have criminal records,david-dewhurst,"crime,immigration",republican,a news story,false,0,1,1,1
Says President Obamas new immigration plan is amnesty.,says president obamas new immigration plan is amnesty,jim-demint,immigration,republican,a news release,barely-true,1,1,0,0
"If you look at the application for a security clearance, I have a clearance that even the president of the United States cannot obtain because of my background.",if you look at the application for a security clearance i have a clearance that even the president of the united states cannot obtain because of my background,allen-west,OTHER,republican,a candidate forum,pants-fire,0,1,1,1
"Says state Rep. Sandy Pasch, her recall opponent, voted to allow public school employees to use taxpayer dollars to pick up the tab forViagra.",says state rep sandy pasch her recall opponent voted to allow public school employees to use taxpayer dollars to pick up the tab forviagra,alberta-darling,"health-care,unions",republican,OTHER,pants-fire,0,1,1,1
"Says Chris Christies plan to kick-start our economy is to propose an income tax cut that disproportionately benefits the wealthy, and...hes still proposing it.",says chris christies plan to kick start our economy is to propose an income tax cut that disproportionately benefits the wealthy and hes still proposing it,barbara-buono,taxes,democrat,OTHER,pants-fire,0,1,1,1
I think its seven or eight of the California system of universities dont even teach an American history course. Its not even available to be taught.,i think its seven or eight of the california system of universities dont even teach an american history course its not even available to be taught,rick-santorum,"education,history",republican,OTHER,false,0,1,1,1
Says the governor is going around the state talking about [how] we should fund an income tax cut that benefits higher income earners and not lower income earners,says the governor is going around the state talking about how we should fund an income tax cut that benefits higher income earners and not lower income earners,OTHER,"state-budget,state-finances,taxes",democrat,OTHER,false,0,1,0,1
