statement,statement_clean,speaker,subject,party_affiliation,context,label,y,baseline_pred,final_linear_pred,xgb_pred
The problem with raising tax rates on the wealthiest Americans is that more than half of them are small business owners.,the problem with raising tax rates on the wealthiest americans is that more than half of them are small business owners,john-boehner,"deficit,federal-budget,taxes",republican,a news conference,false,0,1,0,1
About 78 to 81 House Democrats are members of the Communist Party. ... Its called the Congressional Progressive Caucus.,about 78 to 81 house democrats are members of the communist party its called the congressional progressive caucus,allen-west,candidates-biography,republican,OTHER,pants-fire,0,1,1,1
Bill McCollum backed Jim Greers effort to hide financial irregularities.,bill mccollum backed jim greers effort to hide financial irregularities,rick-scott,OTHER,republican,a TV ad.,false,0,1,1,1
Says under President Barack Obama theres been the lowest discretionary spending weve had in decades in the United States.,says under president barack obama theres been the lowest discretionary spending weve had in decades in the united states,cory-booker,federal-budget,democrat,OTHER,false,0,1,1,1
"In one year, (President Obama) provided $90 billion in breaks to the green energy world into solar and wind, to Solyndra and Fisker and Tesla and Ener1.",in one year president obama provided 90 billion in breaks to the green energy world into solar and wind to solyndra and fisker and tesla and ener1,mitt-romney,OTHER,republican,the first presidential debate in Denver,false,0,1,0,1
Hedge fund managers pay less in taxes than nurses and truck drivers.,hedge fund managers pay less in taxes than nurses and truck drivers,hillary-clinton,OTHER,democrat,OTHER,false,0,1,1,1
"The big Wall Street banks, the big corporations give many times more political donations to Democrats than Republicans.",the big wall street banks the big corporations give many times more political donations to democrats than republicans,jim-demint,OTHER,republican,an interview,false,0,1,0,1
David Perdue has never voted in a Republican primary until his name was on the ballot.,david perdue has never voted in a republican primary until his name was on the ballot,jack-kingston,voting-record,republican,OTHER,false,0,1,1,1
Says in Texas its legal to shoot someone whos committing a public nuisance under the cover of dark.,says in texas its legal to shoot someone whos committing a public nuisance under the cover of dark,OTHER,"guns,legal-issues",democrat,a blog post,false,0,1,1,1
Says Oregon state employees received a catch-up pay raise in 1981 -- just two years after they agreed not to take a raise in exchange for a retirement benefit.,says oregon state employees received a catch up pay raise in 1981 just two years after they agreed not to take a raise in exchange for a retirement benefit,dennis-richardson,OTHER,republican,OTHER,false,0,1,1,1
"All of Texas is conservative, except a little bit of Austin.",all of texas is conservative except a little bit of austin,sean-hannity,OTHER,none,OTHER,false,0,1,0,1
"Scientists have shown us (that) the greater possibilities, the real science movement, has been with adult stem cell research. It has not been with embryonic.",scientists have shown us that the greater possibilities the real science movement has been with adult stem cell research it has not been with embryonic,scott-walker,health-care,republican,OTHER,false,0,1,1,1
On implementing a sales tax.,on implementing a sales tax,OTHER,"message-machine,taxes",democrat,a television ad,false,0,1,1,1
"A few weeks ago, (the) education committee in Congress is deciding whats going to be in your local salad bar.",a few weeks ago the education committee in congress is deciding whats going to be in your local salad bar,dave-brat,OTHER,republican,OTHER,false,0,1,0,1
Warren Buffett called (Jeff) Greenes scheme financial weapons of mass destruction.,warren buffett called jeff greenes scheme financial weapons of mass destruction,kendrick-meek,OTHER,democrat,a television ad,false,0,1,1,1
Over half the people on disability are either anxious or their back hurts.,over half the people on disability are either anxious or their back hurts,rand-paul,disability,republican,a speech in New Hampshire,false,0,1,1,1
One of every two Wisconsin residents are on some kind of government handout.,one of every two wisconsin residents are on some kind of government handout,OTHER,OTHER,republican,OTHER,false,0,1,0,1
"A new ruling by the EPA would force dairy farmers to comply with the Spill Prevention, Control and Countermeasure Program when dealing with spilt milk -- the same regulations oil and natural gas producers must follow.",a new ruling by the epa would force dairy farmers to comply with the spill prevention control and countermeasure program when dealing with spilt milk the same regulations oil and natural gas producers must follow,morgan-griffith,environment,republican,a newsletter.,false,0,1,1,1
"Last year, we had zero percent growth in GDP in Virginia ...The only states that did worse than us were Alaska and Mississippi.",last year we had zero percent growth in gdp in virginia the only states that did worse than us were alaska and mississippi,OTHER,economy,republican,OTHER,true,1,1,0,0
"In the U.S. Constitution, theres a little section in there that talks about life, liberty and the pursuit of happiness.",in the u s constitution theres a little section in there that talks about life liberty and the pursuit of happiness,herman-cain,history,republican,OTHER,false,0,1,1,1
"Your tax dollars are not being used to sue you, the people.",your tax dollars are not being used to sue you the people,alan-hays,redistricting,republican,OTHER,false,0,1,1,1
We now work the longest hours of any people around the world.,we now work the longest hours of any people around the world,bernie-s,labor,independent,OTHER,false,0,1,1,1
Says more Republicans than Democrats voted for the Wall Street bailouts.,says more republicans than democrats voted for the wall street bailouts,kurt-schrader,OTHER,democrat,a radio show,false,0,1,1,1
A bill that could restrict free speech when the president is nearby was signed by President Barack Obama in secret.,a bill that could restrict free speech when the president is nearby was signed by president barack obama in secret,andrew-napolitano,OTHER,republican,an interview on Fox News,pants-fire,0,1,0,1
"This town (Wilmington, Ohio) hasnt taken any money from the government. They dont want any money from the government.",this town wilmington ohio hasnt taken any money from the government they dont want any money from the government,glenn-beck,OTHER,none,OTHER,pants-fire,0,1,0,1
"We were not, I repeat, were not told that waterboarding or any of these other enhanced interrogation methods were used.",we were not i repeat were not told that waterboarding or any of these other enhanced interrogation methods were used,nancy-pelosi,terrorism,democrat,a news conference.,false,0,1,1,1
Says Ron Johnson helped companies ship jobs overseas.,says ron johnson helped companies ship jobs overseas,russ-feingold,OTHER,democrat,a TV ad,false,0,1,1,1
Says Bill Clinton opposes President Barack Obamas plan to raise taxes on wealthy Americans.,says bill clinton opposes president barack obamas plan to raise taxes on wealthy americans,american-crossroads,"message-machine,taxes",republican,OTHER,false,0,1,0,1
Our economy is not growing.,our economy is not growing,rick-scott,economy,republican,a speech at the Republican convention,false,0,1,1,1
"Obama has ""visited more countries and met with more world leaders than any president in his first six months in office.""",obama has visited more countries and met with more world leaders than any president in his first six months in office,chain-email,foreign-policy,none,a widely circulated e-mail,true,1,1,0,0
"Says Texas has so few gas-pump inspectors in the field, the HEBs of this state, the Brookshires of this state, theyre calibrating their own gas pumps. The (Texas Department of Agriculture) just sends them the stickers and they calibrate them.",says texas has so few gas pump inspectors in the field the hebs of this state the brookshires of this state theyre calibrating their own gas pumps the texas department of agriculture just sends them the stickers and they calibrate them,hank-gilbert,OTHER,democrat,a speech.,false,0,1,1,1
Senator Obama has voted 94 times to either increase your taxes or against tax cuts.,senator obama has voted 94 times to either increase your taxes or against tax cuts,john-mccain,taxes,republican,OTHER,false,0,1,1,1
Lorain is the poorest urban school district in the state of Ohio.,lorain is the poorest urban school district in the state of ohio,OTHER,OTHER,democrat,OTHER,false,0,1,1,1
Says President Barack Obama said that American exceptionalism is no more exceptional than the exceptionalism of any other country.,says president barack obama said that american exceptionalism is no more exceptional than the exceptionalism of any other country,rudy-giuliani,OTHER,republican,OTHER,false,0,1,0,1
The U.S. Supreme Court struck down Wisconsins photo ID election law,the u s supreme court struck down wisconsins photo id election law,debbie-wasserman-schultz,elections,democrat,a news release,false,0,1,1,1
"A telephone company will no longer have to provide landline service to customers if there is an alternative provider, including wireless.",a telephone company will no longer have to provide landline service to customers if there is an alternative provider including wireless,ward-armstrong,market-regulation,democrat,OTHER,true,1,1,0,0
Alexander Hamilton was an immigration hawk.,alexander hamilton was an immigration hawk,rush-limbaugh,"history,immigration",none,OTHER,half-true,1,1,0,0
A few weeks ago Obama took Hamas and Iran OFF the terror list.,a few weeks ago obama took hamas and iran off the terror list,glenn-beck,OTHER,none,a Facebook post,false,0,1,1,1
The Electric Reliability Council of Texas (ERCOT) has estimated that the Obama administrations Power Plan will cause energy costs in Texas to rise as much as 16 percent per year.,the electric reliability council of texas ercot has estimated that the obama administrations power plan will cause energy costs in texas to rise as much as 16 percent per year,lamar-smith,OTHER,republican,OTHER,false,0,1,1,1
Jebs policies in Florida helped lead to its almost total collapse.,jebs policies in florida helped lead to its almost total collapse,donald-trump,OTHER,republican,a tweet,barely-true,1,1,0,0
"Says kids who start in the ninth grade in the city of Newark this past September, 23 percent of them will graduate in four years.",says kids who start in the ninth grade in the city of newark this past september 23 percent of them will graduate in four years,chris-christie,education,republican,a radio interview,pants-fire,0,1,1,1
Says Donald Trump wants to replace Obamacare with a single-payer system.,says donald trump wants to replace obamacare with a single payer system,OTHER,"health-care,public-health",republican,an interview,half-true,1,1,0,0
All private healthcare plans must conform to government rules to participate in a Healthcare Exchange.,all private healthcare plans must conform to government rules to participate in a healthcare exchange,chain-email,OTHER,none,a chain e-mail,true,1,1,0,0
On debating.,on debating,rick-perry,elections,republican,a press release,false,0,1,0,1
"Obama supports ""teaching schoolchildren in 2nd grade, no less about homosexual relationships.""",obama supports teaching schoolchildren in 2nd grade no less about homosexual relationships,focus-family-action,OTHER,none,OTHER,barely-true,1,0,0,0
Virtually every person across this country has seen premiums going up and up and up due to Obamacare.,virtually every person across this country has seen premiums going up and up and up due to obamacare,ted-cruz,health-care,republican,OTHER,false,0,1,1,1
All the talk about socialism during the campaign made young people more interested in it by Election Day.,all the talk about socialism during the campaign made young people more interested in it by election day,michael-moore,economy,none,OTHER,false,0,1,1,1
Ive done more impeachments than anybody else in the history of the country.,ive done more impeachments than anybody else in the history of the country,jim-sensenbrenner,OTHER,republican,OTHER,true,1,1,1,0
"Says Marco Rubio believes the earth is 9,000 years old and that humans hunted dinosaurs to extinction; says Rand Paul believes the earth is 10,000 years old and God removed dinosaurs to make space for humans.",says marco rubio believes the earth is 9 000 years old and that humans hunted dinosaurs to extinction says rand paul believes the earth is 10 000 years old and god removed dinosaurs to make space for humans,facebook-posts,OTHER,none,OTHER,pants-fire,0,1,0,1
"In countries where there are higher, more strict gun laws, there is more gun violence.",in countries where there are higher more strict gun laws there is more gun violence,OTHER,guns,none,"a broadcast of ""The Five"" on Fox News",false,0,1,1,1
"While (Charlie Crist) was governor, utility costs went up 30 percent and went from below the national average to above the national average. Since I got elected, utility rates have come down 11 percent and now we are below the average.",while charlie crist was governor utility costs went up 30 percent and went from below the national average to above the national average since i got elected utility rates have come down 11 percent and now we are below the average,rick-scott,OTHER,republican,a debate,false,0,1,1,1
"Bernie Sanders opposesthe Trans-Pacific Partnership, and Hillary Clinton supportsit.",bernie sanders opposesthe trans pacific partnership and hillary clinton supportsit,viral-image,trade,none,OTHER,mostly-true,1,1,0,0
On supporting right to work legislation in 2015,on supporting right to work legislation in 2015,scott-walker,OTHER,republican,a statement,false,0,1,1,1
"POTUS economists: Stimulus Has Cost $278,000 per job.",potus economists stimulus has cost 278 000 per job,john-boehner,stimulus,republican,a tweet on Twitter,false,0,1,1,1
"Says Donald Trumps conversion to pro-life beliefs are akin to Justin Biebers, who said in the past that abortion was no big deal to him.",says donald trumps conversion to pro life beliefs are akin to justin biebers who said in the past that abortion was no big deal to him,sarah-palin,abortion,republican,an interview on CNN,false,0,1,0,1
Says Bill White profiteered in the aftermath of Hurricane Rita.,says bill white profiteered in the aftermath of hurricane rita,rick-perry,OTHER,republican,OTHER,false,0,1,0,1
Metro on whether it could use bond money for restoration.,metro on whether it could use bond money for restoration,OTHER,taxes,none,OTHER,false,0,1,1,1
Barack Obama thinks terrorists just need a good talking to.,barack obama thinks terrorists just need a good talking to,republican-national-committee-republican,terrorism,republican,OTHER,pants-fire,0,1,1,1
"Illinois suffered 1,652 overdose deaths in 2014 ... of which 40 percent were associated with heroin. Illinois is ranked number one in the nation for a decline in treatment capacity between 2007 and 2012, and is now ranked the third worst in the country for state-funded treatment capacity.",illinois suffered 1 652 overdose deaths in 2014 of which 40 percent were associated with heroin illinois is ranked number one in the nation for a decline in treatment capacity between 2007 and 2012 and is now ranked the third worst in the country for state funded treatment capacity,OTHER,drugs,democrat,a press release,true,1,1,1,0
The minimum wage has risen $2.35 in the last two years. Thats 31 percent.,the minimum wage has risen 2 35 in the last two years thats 31 percent,OTHER,OTHER,democrat,OTHER,false,0,1,1,1
"Unfortunately, since Mr. Fosters been mayor ... there are less people employed in the city of St. Petersburg than there were prior to his taking office.",unfortunately since mr fosters been mayor there are less people employed in the city of st petersburg than there were prior to his taking office,OTHER,jobs,democrat,OTHER,false,0,1,1,1
"Says U.S. Rep. Ron Kinds stimulus cost taxpayers $278,000 per job.",says u s rep ron kinds stimulus cost taxpayers 278 000 per job,national-republican-congressional-committee,OTHER,republican,a news release,false,0,1,0,1
"Under the White Houses budget proposal, we will not be adding more to the national debt by the middle of the decade.",under the white houses budget proposal we will not be adding more to the national debt by the middle of the decade,barack-obama,"deficit,federal-budget",democrat,a press conference,false,0,1,1,1
Says CharlieCrist made it easier for Duke to take your money.,says charliecrist made it easier for duke to take your money,republican-party-florida,OTHER,republican,a campaign commercial,false,0,1,1,1
Says a Barack Obama black imposter joke got a standing ovation at San Angelo rodeo.,says a barack obama black imposter joke got a standing ovation at san angelo rodeo,chain-email,polls,none,a chain email.,barely-true,1,1,0,0
"Over the past year ... our 16 counties have hemorrhaged more than 6,000 jobs with no apparent end in sight.",over the past year our 16 counties have hemorrhaged more than 6 000 jobs with no apparent end in sight,steve-southerland,"economy,stimulus",republican,a press release.,false,0,1,1,1
"Since President Barack Obama took office, you have 1,700 employees just at the Department of Transportation earning over $170,000.",since president barack obama took office you have 1 700 employees just at the department of transportation earning over 170 000,eric-hovde,OTHER,republican,an interview,false,0,1,1,1
"Congress includes 36 people accused of spousal abuse, 84 arrested for drunk driving in the past year, 71 with terrible creditand more.",congress includes 36 people accused of spousal abuse 84 arrested for drunk driving in the past year 71 with terrible creditand more,facebook-posts,OTHER,none,a Facebook meme,pants-fire,0,1,1,1
Says Wisconsin women facing pay discrimination cant do something about it under bill passed by Republicans.,says wisconsin women facing pay discrimination cant do something about it under bill passed by republicans,kathleen-falk,OTHER,democrat,a speech,false,0,1,1,1
The New England Journal of Medicine released a survey the week that President Obama signed Obamacare stating that over 30 percent of American physicians would leave the profession if the government took over health care.,the new england journal of medicine released a survey the week that president obama signed obamacare stating that over 30 percent of american physicians would leave the profession if the government took over health care,michele-bachmann,health-care,republican,OTHER,false,0,1,0,1
The Obama administration gave Iran $400 million in ransom payment cash.,the obama administration gave iran 400 million in ransom payment cash,donald-trump,OTHER,republican,OTHER,barely-true,1,1,0,0
"I remember one of [Curt Schillings] teammates said he painted his sock, the bloody sock.",i remember one of curt schillings teammates said he painted his sock the bloody sock,lincoln-chafee,OTHER,democrat,OTHER,false,0,1,1,1
Canada sets aside 36 percent of their visas for people with skills they think their country needs. We set aside 6 percent.,canada sets aside 36 percent of their visas for people with skills they think their country needs we set aside 6 percent,michael-bloomberg,immigration,independent,"an interview on ""Meet the Press.""",false,0,1,0,1
The federal health care law is probably the biggest tax increase ever in the history of our country.,the federal health care law is probably the biggest tax increase ever in the history of our country,rick-scott,"health-care,taxes",republican,OTHER,false,0,1,0,1
"Because of voter fraud, Republican candidates need to do a point or two better to win statewide elections in Wisconsin.",because of voter fraud republican candidates need to do a point or two better to win statewide elections in wisconsin,reince-priebus,OTHER,republican,an interview,false,0,1,1,1
Ohioans want an end to pay-to-play politics.,ohioans want an end to pay to play politics,ed-fitzgerald,OTHER,democrat,OTHER,false,0,1,1,1
General Motors is the largest corporation in the world again.,general motors is the largest corporation in the world again,joe-biden,"corporations,economy",democrat,OTHER,false,0,1,1,1
Says Ohio Treasurer Josh Mandel supports allowing the United States to default on its obligations.,says ohio treasurer josh mandel supports allowing the united states to default on its obligations,ohio-democratic-party,"deficit,federal-budget",democrat,a news release,pants-fire,0,1,1,1
On subsidies for ethanol production.,on subsidies for ethanol production,george-allen,OTHER,republican,a blog post.,false,0,1,0,1
"Says she brought together business, labor and hospitals to give 94,000 Oregon children health care.",says she brought together business labor and hospitals to give 94 000 oregon children health care,eileen-brady,health-care,democrat,OTHER,mostly-true,1,1,0,0
Says Barack Obama is the first president in modern history not to have a single year of 3 percent growth.,says barack obama is the first president in modern history not to have a single year of 3 percent growth,donald-trump,economy,republican,a campaign speech,mostly-true,1,1,0,0
"What I look at every month is how many more New Jerseyans are back to work. You have another 9,900 last month that are back to work and over almost 90,000 that are back to work now since I became governor.",what i look at every month is how many more new jerseyans are back to work you have another 9 900 last month that are back to work and over almost 90 000 that are back to work now since i became governor,chris-christie,jobs,republican,a news conference,false,0,1,1,1
Says the secret John Doe criminal investigation of his campaign has been resolved and two judges have said it is over.,says the secret john doe criminal investigation of his campaign has been resolved and two judges have said it is over,scott-walker,"campaign-finance,legal-issues",republican,a TV interview,false,0,1,1,1
"I'll tell you what I can tell this country: If they want a president who doesn't believe in God, there's probably plenty of choices.",i'll tell you what i can tell this country if they want a president who doesn't believe in god there's probably plenty of choices,mike-huckabee,religion,republican,OTHER,false,0,1,1,1
Drinking champagne could help prevent Alzheimers and other forms of dementia.,drinking champagne could help prevent alzheimers and other forms of dementia,OTHER,OTHER,none,OTHER,false,0,1,1,1
Ford is moving all of their small-car production to Mexico.,ford is moving all of their small car production to mexico,donald-trump,OTHER,republican,OTHER,mostly-true,1,1,0,0
"For every dollar (in the stimulus package) that is spent to help small businesses, $4 is being spent to help upkeep the grass on the lawns of Washington.",for every dollar in the stimulus package that is spent to help small businesses 4 is being spent to help upkeep the grass on the lawns of washington,eric-cantor,"economy,stimulus",republican,an interview on the Fox News Channel.,false,0,1,0,1
Says that his transportation budget and Ohio Turnpike plan would make sure we have lower tolls than weve had through the history of the turnpike.,says that his transportation budget and ohio turnpike plan would make sure we have lower tolls than weve had through the history of the turnpike,john-kasich,transportation,republican,OTHER,pants-fire,0,1,1,1
The Madison-Milwaukee (high-speed) train line is dead.,the madison milwaukee high speed train line is dead,scott-walker,OTHER,republican,OTHER,false,0,1,1,1
I never favored cap and trade.,i never favored cap and trade,newt-gingrich,OTHER,republican,OTHER,false,0,1,0,1
Says the Simpson-Bowles deficit reduction proposal went from President Barack Obamas desk to the garbage can.,says the simpson bowles deficit reduction proposal went from president barack obamas desk to the garbage can,jon-huntsman,OTHER,republican,OTHER,false,0,1,1,1
President Obama and liberal former DNC Chairman Tim Kaines $787 billion stimulus failed to create jobs.,president obama and liberal former dnc chairman tim kaines 787 billion stimulus failed to create jobs,national-republican-senatorial-committee,OTHER,republican,a press release.,false,0,0,1,1
Says the National Labor Relations Board told Boeing that it cant build a factory in a non-union state.,says the national labor relations board told boeing that it cant build a factory in a non union state,mitt-romney,OTHER,republican,a Republican presidential primary debate,false,0,1,1,1
On Donald Trumps track record in business,on donald trumps track record in business,mitt-romney,candidates-biography,republican,OTHER,false,0,1,0,1
The amount of money that we put into running our own state legislature is nearly as much as we put into the University of Rhode Island.,the amount of money that we put into running our own state legislature is nearly as much as we put into the university of rhode island,OTHER,OTHER,republican,a radio interview,false,0,1,1,1
"Says after leaving the White House, Hillary Clinton was forced to return an estimated $200,000 in White House china, furniture and artwork that she had stolen.",says after leaving the white house hillary clinton was forced to return an estimated 200 000 in white house china furniture and artwork that she had stolen,viral-image,ethics,none,OTHER,barely-true,1,1,0,0
